{
  "schema_version": "1.0",
  "rows": [
    {
      "id": "visual-hierarchy",
      "family": "visual",
      "name": "Visual hierarchy",
      "one_line": "A layout should make the order in which things are meant to be read visible before any of them is read.",
      "plain_gloss": "Before someone reads a single word, the page has already told them what to look at first. If it hasn't, they pick for themselves — and they usually pick wrong.",
      "origin": null,
      "confidence": "traditional",
      "confidence_note": "Long-standing studio and editorial practice with no single origin; it is a way of describing what scale, weight, space and position do together rather than a finding of its own.",
      "common_misuse": "Treated as 'make the important thing big', which produces three big things and therefore no hierarchy at all. Hierarchy is a ranking, and a ranking needs things below the top.",
      "limits": "It assumes the designer knows what the reader wants first. On a screen serving two readers with different questions — a bill read by a customer and by a call handler — there is no single correct order, and the honest answer is two layouts or an explicit compromise.",
      "weeks": [
        2
      ],
      "source_url": null
    },
    {
      "id": "visual-contrast",
      "family": "visual",
      "name": "Contrast (visual weight)",
      "one_line": "Difference is what makes an element noticeable; an element that differs from its neighbours in nothing will not be seen as separate from them.",
      "plain_gloss": "Things stand out by being different from what is around them, not by being loud. A heavy word among light ones is louder than a heavy word among heavy ones.",
      "origin": null,
      "confidence": "traditional",
      "confidence_note": "Craft vocabulary rather than a sourced claim. It is the working half of visual hierarchy and is taught as technique, not as evidence.",
      "common_misuse": "Reached for as a synonym for colour contrast, so a student writes 'good contrast' about a layout and means the text passes a ratio check. They are different arguments and only one of them is measurable.",
      "limits": "Contrast is relative to context, so it cannot be specified once for a design system and applied everywhere. The same treatment that separates a heading on a sparse page disappears on a dense one.",
      "weeks": [
        2
      ],
      "source_url": null
    },
    {
      "id": "scale",
      "family": "visual",
      "name": "Scale",
      "one_line": "Relative size is the fastest signal of importance available on a screen, and it is read before shape, colour or wording.",
      "plain_gloss": "Size is the first thing anyone notices, so whatever you set biggest is the thing you have decided matters — whether or not that is what you meant.",
      "origin": null,
      "confidence": "traditional",
      "confidence_note": "Studio practice. The related empirical work concerns legibility at a given size, which is a different claim from the one made here about relative size and importance.",
      "common_misuse": "Used to build a type scale with seven steps, five of which are never distinguishable in use. A scale earns a step only when a reader can tell it from the step below.",
      "limits": "Scale competes with position: something small at the top of a page can outrank something large below the fold, so size cannot be reasoned about apart from where it sits.",
      "weeks": [
        2
      ],
      "source_url": null
    },
    {
      "id": "proximity",
      "family": "visual",
      "name": "Proximity",
      "one_line": "Elements placed close together are perceived as belonging together, and the perception happens before any label is read.",
      "plain_gloss": "Put two things near each other and people assume they go together. Space does the grouping whether you meant it to or not — which is why a label drifting towards the wrong field is read as belonging to it.",
      "origin": "Max Wertheimer, 'Laws of Organization in Perceptual Forms', 1923 (Ellis translation, 1938)",
      "confidence": "documented",
      "confidence_note": "Stated in Wertheimer's 1923 paper as the Factor of Proximity; the cited page carries the translated text itself rather than a description of it.",
      "common_misuse": "Applied as 'add space between sections' while the spacing inside a section stays the same, so the grouping is announced and then contradicted. The gap within must be smaller than the gap between, and usually is not.",
      "limits": "Proximity is a grouping cue, not a hierarchy cue: it says these things belong together, and says nothing about which of them matters. It also loses to a strong border or a fill, which can group elements that are far apart.",
      "weeks": [
        2
      ],
      "source_url": "https://psychclassics.yorku.ca/Wertheimer/Forms/forms.htm"
    },
    {
      "id": "similarity",
      "family": "visual",
      "name": "Similarity",
      "one_line": "Elements that share an appearance are perceived as a set, even when they are separated in space.",
      "plain_gloss": "Anything that looks the same gets read as the same kind of thing. Style two unrelated items alike and people will assume they do the same job.",
      "origin": "Max Wertheimer, 'Laws of Organization in Perceptual Forms', 1923 (Ellis translation, 1938)",
      "confidence": "documented",
      "confidence_note": "Stated in Wertheimer's 1923 paper as the Factor of Similarity, on the same page as proximity; both are quoted there in the translated text.",
      "common_misuse": "Turned into a licence to style every clickable thing identically, so a destructive action and a harmless one become members of the same visible set and are chosen with the same care.",
      "limits": "Similarity and proximity can be made to disagree, and when they do the outcome depends on how strong each cue is — which the principle does not predict. It is a description of grouping, not a rule for resolving conflicts between groupings.",
      "weeks": [
        2
      ],
      "source_url": "https://psychclassics.yorku.ca/Wertheimer/Forms/forms.htm"
    },
    {
      "id": "figure-ground",
      "family": "visual",
      "name": "Figure and ground",
      "one_line": "Perception separates a scene into a shape being attended to and a background it sits on, and only one of them can be the figure at a time.",
      "plain_gloss": "Your eye picks one thing to be the object and treats everything else as the backdrop. It cannot do both at once, so if the design does not settle which is which, the reader will — and it may not go your way.",
      "origin": "Edgar Rubin, 'Synsoplevede Figurer', 1915",
      "confidence": "traditional",
      "confidence_note": "The origin is named and datable, but the 1915 thesis is in Danish and no page could be found that states the claim rather than summarising it, so this is not marked documented. That gap is the point of the marker, not a defect in the record.",
      "common_misuse": "Read as a curiosity about ambiguous vases rather than as the reason a modal with a weak overlay fails: if the background is still legible, it is still competing to be the figure.",
      "limits": "It describes what perception does, not what a design should do, and it says nothing about which of two candidates will win. A low-contrast overlay and a heavy one both obey it.",
      "weeks": [
        2
      ],
      "source_url": null
    },
    {
      "id": "alignment",
      "family": "visual",
      "name": "Alignment",
      "one_line": "Shared edges create an implied line, and that line does structural work that no visible rule or border has to do.",
      "plain_gloss": "When things line up, the eye draws an invisible edge between them and reads them as connected. You get a structure without adding a single line to the page.",
      "origin": null,
      "confidence": "traditional",
      "confidence_note": "Typographic and layout craft with no single citable origin. It is the practical reason a grid is worth having, and it is taught by demonstration.",
      "common_misuse": "Everything centred, which produces two ragged edges and no line at all — then a border is added to supply the structure that the alignment was supposed to provide.",
      "limits": "An implied line is weaker than a real one and will not survive a crowded page or a narrow viewport, so alignment alone is not enough where a genuine boundary is needed.",
      "weeks": [
        2,
        3
      ],
      "source_url": null
    },
    {
      "id": "white-space",
      "family": "visual",
      "name": "White space",
      "one_line": "Empty area is a working part of a layout: it separates, groups and paces, and removing it removes those functions.",
      "plain_gloss": "The gaps are doing a job. Space is not the bit left over after the content is placed — it is what tells someone where one thing ends and the next begins.",
      "origin": null,
      "confidence": "traditional",
      "confidence_note": "Long-standing print and studio practice. The general claim is craft; the specific figures people attach to it — golden gaps, fixed ratios — are not sourced and are not repeated here.",
      "common_misuse": "Defended as 'it needs to breathe' while the space is distributed evenly, which groups nothing. Uniform space is the same as no space as far as grouping is concerned.",
      "limits": "Space is expensive on a small screen and in print, and on a dense screen — a timetable, a bill — the honest solution is often rules and tints rather than more air.",
      "weeks": [
        2,
        3
      ],
      "source_url": null
    },
    {
      "id": "measure",
      "family": "visual",
      "name": "Measure (line length)",
      "one_line": "Line length affects the ease of returning from the end of one line to the start of the next, and screen type is often set far wider than it is set in print.",